{
  "version": "0.1",
  "type": "cap_array",
  "inputs": {
    "topology": {
      "cap_list": [
        1
      ],
      "connection": "userDefined",
      "plusConnected": "(1)",
      "connectDummyCaps": "open_floating",
      "boundary_caps": {
        "left": false,
        "right": false,
        "top": false,
        "bottom": false,
        "boundary_device_size": "Unit"
      }
    },
    "placement": {
      "rows": 1,
      "algorithm": "user",
      "pattern": [
        [
          "C1_1"
        ]
      ]
    },
    "dummy_caps": {
      "naming_rule": "C0_<idx>"
    },
    "routing_options": {
      "nVias": 2,
      "wireWidthHor": 0.4,
      "wireWidthVer": 0.4,
      "wireWidthPlus": 0.6,
      "wireWidthMinus": 0.6,
      "truncVerWires": true,
      "truncHorWires": false,
      "verWireAssignment": "minus-plus",
      "horWireAssignment": "symmetric",
      "verShielding": "shield-pin",
      "horShielding": "plus-minus",
      "guardRingOptions": {
        "left": true,
        "right": true,
        "top": true,
        "bottom": false
      },
      "addGuardRingSpacing": 0.8
    },
    "advanced": {
      "horDevSpacing": 0.2,
      "verDevSpacing": 0.2,
      "minHorDevBusSpacing": 0.15,
      "minVerDevBusSpacing": 0.15,
      "noRouting": false,
      "onlyVerticalWires": false,
      "omitHorizontalBus": false,
      "deleteFloatingWires": true,
      "wireSpaceHor": 0.1,
      "wireSpaceVer": 0.1
    }
  },
  "capabilities": {
    "placement": {
      "supported_algorithms": [
        "common_centroid",
        "side-by-side",
        "side-by-side-row-wise",
        "user"
      ],
      "pattern_supported": true
    },
    "routing": {
      "level": "full"
    },
    "advanced": {
      "level": "full"
    },
    "unsupported_option_policy": "ignore_with_warning"
  },
  "output": {
    "libname": "lib",
    "cellname": "cap"
  }
}
